{
  "aggregate": {
    "collector_count": 1,
    "collectors": ["geometry"],
    "discovery_count": 1,
    "max_novelty_score": 92,
    "max_relevance_score": 96,
    "mean_relevance_score": 96.0,
    "repo_paths": [
      "src/synthetic_data_generation/scripts/alignment/calibrate_court_alignment.py",
      "src/tasks/plcs/data/dataset.py",
      "src/tasks/plcs/training/metrics.py",
      "src/tennis_scene/pipeline/components/plcs.py"
    ],
    "tasks": ["plcs", "scene_alignment", "tennis_scene"]
  },
  "curation": {
    "decision": "promoted",
    "issue": 698,
    "paper_node": "paper-doi-10-48550-arxiv-2606-20542",
    "proposal_nodes": ["proposal-plcs-caltennis-cross-view-eval"],
    "reason_ja": "公式全文・project・公開datasetを確認した。実tennisの2〜6同期viewとcourt calibrationを用いるlabel-free cross-view評価は、合成教師3D中心のPLCSへ独立したreal-domain評価軸を追加でき、現行課題への直接性が高い。absolute ground truthではないこと、非商用条件、SMPL-X contract差を明記し、paperと外部評価proposalへ分離して昇格する。",
    "reviewed_at": "2026-08-06T00:20:00+09:00"
  },
  "discoveries": [
    {
      "collector_id": "geometry",
      "discovered_at": "2026-08-05T15:45:30+09:00",
      "schedule_run_id": "geometry-20260805T154530+0900-a7c2",
      "screening": {
        "applicability_ja": "tennis-labのPLCSはAMASS/SMPL-H由来の合成sceneを中心に、2D人物poseとcourt keypointからcourt座標のposition/yawを推定し、現行PLCSMetricsは教師3Dとの誤差を中心に集計する。CalTennisのmini split、timestamps、camera calibrationをSceneDatasetへ適応し、PLCSModuleを実テニス映像で動かした上で、論文のcross-view translation・pose・footwork系指標を追加すれば、合成データ上の精度とは独立に実環境での深度安定性を測れる。コート線からの外部パラメータ推定手順は、既存court-alignment実装の候補生成・評価方法との比較対象にもなる。",
        "candidate_experiment_ja": "CalTennis miniのうち3視点以上を持つ同期区間から20クリップを固定する。baselineは各cameraのGVHMR global translationを提供済みextrinsicsでcourt座標へ変換した結果、変更条件は同じ2D poseとcourt keypointを既存PLCSへcamera pairごとに入力した結果とする。camera pair間のposition/yawを比較し、median pairwise translation disagreement [m]、yaw disagreement [deg]、pelvis相対COCO17 disagreement [m]、invalid clip率を測る。PLCSがbaseline比でtranslation disagreementを20%以上低下させ、pelvis相対pose disagreementの悪化が5%以内、invalid率が10%以下なら次段階へ進む。20クリップ終了時に改善が10%未満、invalid率が10%超、またはcalibration座標変換が成立しない場合は停止する。モデル再学習は行わない。",
        "evidence_level": "fulltext",
        "novelty_score": 92,
        "relevance_score": 96,
        "repo_paths": [
          "src/tasks/plcs/data/dataset.py",
          "src/tasks/plcs/training/metrics.py",
          "src/tennis_scene/pipeline/components/plcs.py",
          "src/synthetic_data_generation/scripts/alignment/calibrate_court_alignment.py"
        ],
        "risks_ja": "公開データはCC BY-NC 4.0で商用利用に制約があり、full splitは約122 GBである。絶対的なMoCap真値はなく、multi-view不一致は誤差の下限にすぎないため、複数ビューに共通するbiasは検出できない。iPhone 14以降・固定三脚・特定のコート配置に依存するdomain gapがあり、SMPL-X評価とtennis-labのCOCO17/SMPL-H・court座標契約の変換も必要である。公式projectではcodeがcoming soonのため、現時点では評価実装を論文記述から再構成する必要がある。",
        "summary_ja": "CalTennisは、40名・51時間・約1,103万フレームのテニス映像を2〜6台の同期カメラで60 Hz収録した実環境ベンチマークである。標準化されたコート線交点から各カメラの外部パラメータを推定し、連続時刻上のオフセット最適化で映像を同期して、各単眼3D人体推定を共通コート座標へ持ち上げる。MoCap真値の代わりに、同一人物についてビュー間の3D平行移動、pelvis相対pose、足速度・高さ、安定性、体型の不一致を評価する。5手法の比較では、関節姿勢よりも絶対深度、接地、体型の一貫性が主要な失敗点だった。",
        "tasks": ["plcs", "scene_alignment", "tennis_scene"]
      },
      "sources": [
        {"checked_at": "2026-08-05T15:45:30+09:00", "kind": "paper", "url": "https://arxiv.org/abs/2606.20542"},
        {"checked_at": "2026-08-05T15:45:30+09:00", "kind": "project", "url": "https://ilonadem.github.io/caltennis-website/"},
        {"checked_at": "2026-08-05T15:45:30+09:00", "kind": "dataset", "url": "https://huggingface.co/datasets/demalenk/caltennis"}
      ]
    }
  ],
  "first_seen": "2026-08-05T15:45:30+09:00",
  "id": "paper-doi-10-48550-arxiv-2606-20542",
  "last_seen": "2026-08-05T15:45:30+09:00",
  "paper": {
    "authors": ["Ilona Demler", "Xinran Xie", "Blake Werner", "Anna Szczuka", "Pietro Perona"],
    "identifiers": {"arxiv": "2606.20542", "doi": "10.48550/arxiv.2606.20542", "openreview": null},
    "title": "CalTennis: Large Multi-View Tennis Video Dataset and Benchmark of Monocular-to-3D Pose Estimation",
    "urls": {"code": null, "dataset": "https://huggingface.co/datasets/demalenk/caltennis", "paper": "https://arxiv.org/pdf/2606.20542", "primary": "https://arxiv.org/abs/2606.20542", "project": "https://ilonadem.github.io/caltennis-website/"},
    "venue": null,
    "year": 2026
  },
  "schema_version": 1,
  "state": "promoted"
}
