{
  "aggregate": {
    "collector_count": 1,
    "collectors": ["systems"],
    "discovery_count": 1,
    "max_novelty_score": 92,
    "max_relevance_score": 94,
    "mean_relevance_score": 94.0,
    "repo_paths": [
      "src/synthetic_data_generation/composition/gaussians.py",
      "src/synthetic_data_generation/dataset/plcs/components/scene_plan_builder.py",
      "src/synthetic_data_generation/dataset/plcs/rendering/nht.py"
    ],
    "tasks": ["human_pose", "synthetic_data_generation", "tennis_scene"]
  },
  "curation": {
    "decision": "promoted",
    "issue": 720,
    "paper_node": "paper-doi-10-1109-tvcg-2026-3680708",
    "proposal_nodes": [],
    "reason_ja": "IEEE DOI metadata、arXiv全文、公式project、公式GitHub repositoryを再確認した。単一画像由来のcanonical Gaussian avatarをSMPL-X rigとLBSで連続poseへ駆動するsystemは、現行PLCSの離散pose assetを連続motion assetへ置き換える設計参照として直接性が高い。repository rootに明示的LICENSEを確認できず、LHM・SMPL-X・Unity等の依存licenseも分離が必要なため、現時点ではformal paperとしてpromotedし、code/weightのvendorやready proposal化は見送る。",
    "reviewed_at": "2026-08-08T00:27:00+09:00"
  },
  "discoveries": [
    {
      "collector_id": "systems",
      "discovered_at": "2026-08-08T00:21:12+09:00",
      "schedule_run_id": "systems-20260808T002112+0900-vrgaussianavatar",
      "screening": {
        "applicability_ja": "現行PLCS synthetic rendererはcanonical/ready/forehandの離散pose Gaussian assetをpose_indexで切り替えているため、本手法のcanonical Gaussian + SMPL-X rig + per-frame LBSは、歩行・走行・ストローク等を連続的に変形する人物3DGS assetへ置き換える直接的な候補になる。既存のscene_from_asset配置、camera、Gaussian compositionを維持したまま人物表現だけをanimatable avatarへ差し替える検証が可能で、tennis_sceneの人物合成にもそのまま波及する。",
        "candidate_experiment_ja": "PLCS人物1体について現行の3離散pose asset経路をbaselineとし、VRGaussianAvatar/LHM由来のcanonical Gaussian + SMPL-X rigを既存scene planへ接続する最小adapterを試す。同一カメラ・同一人物軌跡で連続モーションをrenderし、(1) frame間appearance/identity安定性、(2) instance-maskと投影bboxの整合率、(3) 480p/目標解像度でのms/frame・VRAM、(4) downstream PLCS学習用labelとの幾何整合を比較する。離散pose baselineより時間整合性が改善し、許容render throughputを維持できるかを判定する。",
        "evidence_level": "fulltext-code",
        "novelty_score": 92,
        "relevance_score": 94,
        "repo_paths": [
          "src/synthetic_data_generation/dataset/plcs/rendering/nht.py",
          "src/synthetic_data_generation/dataset/plcs/components/scene_plan_builder.py",
          "src/synthetic_data_generation/composition/gaussians.py"
        ],
        "risks_ja": "公式実装はLHM、SMPL-X、Unity/Final IK、特定PyTorch/PyTorch3D環境など外部依存が多く、公開repo上で明示的なソフトウェアlicenseを確認できない。論文自体はCC BY-NC-SA系で公開されており、コード・モデルweight・SMPL-X assetの個別license確認が必要。VR向けHMD trackingとtennis-labのAMASS/PLCS motion入力にはinterface差があり、そのまま統合できるとは限らない。",
        "score_breakdown": {"adoption_feasibility": 7, "evidence_quality": 18, "experiment_quality": 14, "repo_fit": 25, "task_fit": 30},
        "summary_ja": "単一人物画像からLHMで全身3D Gaussian avatarを再構成し、SMPL-X互換rigとlinear blend skinningでフレームごとの姿勢に追従させる実時間システム。左右眼を同一batchで処理するBinocular Batchingも導入し、3DGS状態の重複転送やkernel起動を削減している。IEEE TVCG / IEEE VR 2026で、論文全文と公式実装が公開されている。",
        "tasks": ["synthetic_data_generation", "tennis_scene", "human_pose"],
        "topic": "avatar_rendering"
      },
      "sources": [
        {"checked_at": "2026-08-08T00:21:12+09:00", "kind": "paper", "url": "https://arxiv.org/abs/2602.01674"},
        {"checked_at": "2026-08-08T00:21:12+09:00", "kind": "publisher", "url": "https://doi.org/10.1109/TVCG.2026.3680708"},
        {"checked_at": "2026-08-08T00:21:12+09:00", "kind": "project", "url": "https://vrgaussianavatar.github.io/"},
        {"checked_at": "2026-08-08T00:21:12+09:00", "kind": "code", "url": "https://github.com/hailsong/VRGaussianAvatar"}
      ]
    }
  ],
  "first_seen": "2026-08-08T00:21:12+09:00",
  "id": "paper-doi-10-1109-tvcg-2026-3680708",
  "last_seen": "2026-08-08T00:21:12+09:00",
  "paper": {
    "authors": ["Hail Song", "Boram Yoon", "Seokhwan Yang", "Seoyoung Kang", "Hyunjeong Kim", "Henning Metzmacher", "Woontack Woo"],
    "identifiers": {"arxiv": "2602.01674", "doi": "10.1109/tvcg.2026.3680708", "openreview": null},
    "title": "VRGaussianAvatar: Integrating 3D Gaussian Avatars into VR",
    "urls": {"code": "https://github.com/hailsong/VRGaussianAvatar", "dataset": null, "paper": "https://arxiv.org/abs/2602.01674", "primary": "https://doi.org/10.1109/TVCG.2026.3680708", "project": "https://vrgaussianavatar.github.io/"},
    "venue": "IEEE Transactions on Visualization and Computer Graphics (IEEE VR 2026 journal track)",
    "year": 2026
  },
  "schema_version": 1,
  "state": "promoted"
}
