{
  "aggregate": {
    "collector_count": 1,
    "collectors": [
      "geometry"
    ],
    "discovery_count": 1,
    "max_novelty_score": 90,
    "max_relevance_score": 98,
    "mean_relevance_score": 98.0,
    "repo_paths": [
      "src/tasks/plcs/data/tracking_dataset.py",
      "src/tennis_scene/pipeline/components/gvhmr.py",
      "src/tennis_scene/pipeline/components/player_association.py",
      "src/tennis_scene/pipeline/components/plcs.py"
    ],
    "tasks": [
      "plcs",
      "tennis_scene"
    ]
  },
  "curation": {
    "decision": null,
    "issue": null,
    "paper_node": null,
    "proposal_nodes": [],
    "reason_ja": null,
    "reviewed_at": null
  },
  "discoveries": [
    {
      "collector_id": "geometry",
      "discovered_at": "2026-08-05T16:25:37+09:00",
      "schedule_run_id": "geometry-20260805T162537+0900-m3p9",
      "screening": {
        "applicability_ja": "現行tennis_sceneは各cameraのGVHMR trackをPlayerAssociationModuleのmanual UIでcanonical player軸へ整列してからPLCSModuleへ渡している。player_association.pyへcalibrated camera matrixと各trackのdense projected meshを入力するautomatic_geometry modeを追加し、MAEMの二段gate、Hungarian matching、camera重複解消を実装すれば、出力契約PlayerAssociationResultを変えずに手動対応付けを自動化できる。gvhmr.pyは2D keypoint、bbox、SMPL vertexを既に保持するが、associationに必要な画像上のdense vertex projectionまたはcamera-space translationを公開していないため、そのadapter追加が主要差分となる。tracking_dataset.pyへ実映像由来のassociation confidenceを保持すれば、低信頼frameをPLCS tracking学習・評価から分離できる。",
        "candidate_experiment_ja": "baselineは同期・校正済みの実テニス12 clipについて現行manual_uiで確定したPlayerAssociationResultと、その結果を入力したPLCSのposition_error_mとangular_error_degとする。変更条件は同じGVHMR出力からdense vertex projectionを生成し、MAEM型のbbox再投影gate、mesh epipolar gate、Hungarian matching、Union-Findを適用して自動生成したPlayerAssociationResultとする。manual assignmentとのplayer-camera-frame一致率、ID switch数/10000 player-camera-frame、未割当率、処理時間/frame、およびmanual baselineに対するPLCS position_error_m・angular_error_degの差を測る。12 clip平均で一致率98%以上、ID switchが1以下、未割当率5%以下、処理時間200 ms/frame以下、PLCS position error悪化0.05 m以下なら次段階へ進む。最初の3 clipで一致率95%未満、必要なcamera投影を10%以上のframeで構築不能、または1 s/frameを超える場合は停止する。",
        "evidence_level": "fulltext-code",
        "novelty_score": 90,
        "relevance_score": 98,
        "repo_paths": [
          "src/tennis_scene/pipeline/components/player_association.py",
          "src/tennis_scene/pipeline/components/gvhmr.py",
          "src/tennis_scene/pipeline/components/plcs.py",
          "src/tasks/plcs/data/tracking_dataset.py"
        ],
        "risks_ja": "MAEMは既知のintrinsic/extrinsicと全cameraで同一topologyのdense projected vertexを前提とするが、現行GVHMRResultのsmpl_vertices_localはbody-local座標で画像投影に必要なcamera translationを契約化していない。論文はSAM 3D BodyのMHR 18439 verticesを記述する一方、公開READMEは改変frontendから6890 SMPL verticesを出すと記載しており、論文とcodeのfrontend契約に差がある。pairwise matchingはframe独立で時間的平滑化を持たず、誤clusterがsegment全体のID switchへ波及し得る。計算量はcamera pair、人物候補pair、vertex数に比例し、遠景tennisではmesh projection精度がbasketball benchmarkより低い可能性がある。MAEM本体はMITだが、SAM 3D Body、xrMoCap、SMPL系body model、評価datasetの利用条件とcheckpoint配布条件は別途確認が必要である。",
        "summary_ja": "MAEMは、校正済み複数カメラのチームスポーツ映像に対するtraining-freeのmulti-person 3D pose推定手法である。単眼mesh recoveryが出力する人物bbox、3D keypoint、画像上へ投影した密なbody mesh vertexを用い、bbox中心の再投影誤差による粗い候補除外、対応vertexのepipolar距離による密な幾何filter、camera pairごとのHungarian matching、Union-Findによるmulti-view cluster化、keypoint単位のRANSAC triangulationを順に行う。SportCenter EPFLではMPJPE/PA-MPJPE 59.8/40.7 mm、Human-M3 Basketballでは74.0/51.8 mmを報告し、最良のtraining-free association baselineに対するMPJPE低下はそれぞれ9.0%と19.1%である。",
        "tasks": [
          "plcs",
          "tennis_scene"
        ]
      },
      "sources": [
        {
          "checked_at": "2026-08-05T16:25:37+09:00",
          "kind": "paper",
          "url": "https://arxiv.org/abs/2605.29953"
        },
        {
          "checked_at": "2026-08-05T16:25:37+09:00",
          "kind": "code",
          "url": "https://github.com/Yinlipp/MAEM"
        }
      ]
    }
  ],
  "first_seen": "2026-08-05T16:25:37+09:00",
  "id": "paper-arxiv-2605-29953",
  "last_seen": "2026-08-05T16:25:37+09:00",
  "paper": {
    "authors": [
      "Li Yin",
      "Qin Haobin",
      "Tomohiro Suzuki",
      "Calvin Yeung",
      "Mariko Isogawa",
      "Keisuke Fujii"
    ],
    "identifiers": {
      "arxiv": "2605.29953",
      "doi": null,
      "openreview": null
    },
    "title": "Mesh-Aware Epipolar Matching for Multi-View Multi-Person 3D Pose Estimation in Basketball",
    "urls": {
      "code": "https://github.com/Yinlipp/MAEM",
      "dataset": null,
      "paper": "https://arxiv.org/pdf/2605.29953",
      "primary": "https://arxiv.org/abs/2605.29953",
      "project": null
    },
    "venue": null,
    "year": 2026
  },
  "schema_version": 1,
  "state": "inbox"
}
