{
  "aggregate": {
    "collector_count": 1,
    "collectors": ["geometry"],
    "discovery_count": 1,
    "max_novelty_score": 92,
    "max_relevance_score": 95,
    "mean_relevance_score": 95.0,
    "repo_paths": [
      "src/synthetic_data_generation/scripts/alignment/calibrate_court_alignment.py",
      "src/tennis_scene/configs/pipeline.yaml",
      "src/tennis_scene/pipeline/components/gvhmr.py",
      "src/tennis_scene/pipeline/dependency_graph.py",
      "src/tennis_scene/pipeline/orchestrator.py"
    ],
    "tasks": ["plcs", "scene_alignment", "tennis_scene"]
  },
  "curation": {
    "decision": "promoted",
    "issue": 698,
    "paper_node": "paper-arxiv-2604-17567",
    "proposal_nodes": [],
    "reason_ja": "公式全文、project、MIT code、synthetic evaluation dataを確認した。10.48550/arXiv.2604.17567はarXiv aliasであるためcanonical IDとexternal DOIを訂正した。人体keypointと既知長用具によるmetric-scale calibrationはcourt line欠損時の補完候補だが、主要定量結果はsyntheticでracquet端点検出が未整備であるため、paper nodeとして保持し実装proposalは作らない。",
    "reviewed_at": "2026-08-06T00:20:00+09:00"
  },
  "discoveries": [
    {
      "collector_id": "geometry",
      "discovered_at": "2026-08-05T18:20:05+09:00",
      "schedule_run_id": "geometry-20260805T182005+0900-s8k4",
      "screening": {
        "applicability_ja": "GVHMRのhuman keypoint、racquet両端点、既知intrinsics、実測racquet長からcamera extrinsicsとmetric scaleをPLCS前に復元する候補である。court-only calibrationを独立baselineとして比較できる。",
        "candidate_experiment_ja": "合成sceneの既知cameraを摂動し、court-only BAとhuman+racquet三段BAを比較する。camera rotation/translation error、reprojection error、downstream PLCS error、失敗率、処理時間を測る。",
        "evidence_level": "fulltext-code-data",
        "novelty_score": 92,
        "relevance_score": 95,
        "repo_paths": [
          "src/tennis_scene/pipeline/dependency_graph.py",
          "src/tennis_scene/pipeline/orchestrator.py",
          "src/tennis_scene/pipeline/components/gvhmr.py",
          "src/tennis_scene/configs/pipeline.yaml",
          "src/synthetic_data_generation/scripts/alignment/calibrate_court_alignment.py"
        ],
        "risks_ja": "camera同期、既知intrinsics、複数viewでの人体・用具端点、正確な用具長が前提である。tennis racquet端点は遠景・motion blur・手による遮蔽で不安定で、現行pipelineにcamera stage contractを追加する変更範囲も広い。",
        "summary_ja": "人体2D keypointと既知長のstick状用具端点から、unscaled BA、closed-form scale recovery、lengthとtemporal constraintを加えたscale-aware BAの三段階でmetric camera extrinsicsを自己校正する。",
        "tasks": ["scene_alignment", "plcs", "tennis_scene"]
      },
      "sources": [
        {"checked_at": "2026-08-05T18:20:05+09:00", "kind": "paper", "url": "https://arxiv.org/abs/2604.17567"},
        {"checked_at": "2026-08-05T18:20:05+09:00", "kind": "project", "url": "https://fandulu.github.io/sport_stick_multi_cam_calib/"},
        {"checked_at": "2026-08-05T18:20:05+09:00", "kind": "code", "url": "https://github.com/fandulu/sport_stick_multi_cam_calib"},
        {"checked_at": "2026-08-05T18:20:05+09:00", "kind": "dataset", "url": "https://github.com/fandulu/sport_stick_multi_cam_calib/tree/main/data"}
      ]
    }
  ],
  "first_seen": "2026-08-05T18:20:05+09:00",
  "id": "paper-arxiv-2604-17567",
  "last_seen": "2026-08-05T18:20:05+09:00",
  "paper": {
    "authors": ["Fan Yang", "Changsoo Jung", "Ryosuke Kawamura", "Hon Yung Wong"],
    "identifiers": {"arxiv": "2604.17567", "doi": null, "openreview": null},
    "title": "Multi-Camera Self-Calibration in Sports Motion Capture: Leveraging Human and Stick Poses",
    "urls": {"code": "https://github.com/fandulu/sport_stick_multi_cam_calib", "dataset": "https://github.com/fandulu/sport_stick_multi_cam_calib/tree/main/data", "paper": "https://arxiv.org/pdf/2604.17567", "primary": "https://arxiv.org/abs/2604.17567", "project": "https://fandulu.github.io/sport_stick_multi_cam_calib/"},
    "venue": "2026 IEEE 20th International Conference on Automatic Face and Gesture Recognition (FG 2026)",
    "year": 2026
  },
  "schema_version": 1,
  "state": "promoted"
}
